{"$schema":"https://json-schema.org/draft/2020-12/schema","$id":"https://github.com/choonkiatlee/sparkles/blob/master/docs/360/external-benchmark/pricescope/expert-observation.schema.json","title":"Sparkles expert observation corpus","type":"object","required":["schema_version","corpus_id","purpose","interpretation_contract","observations","coverage"],"properties":{"schema_version":{"const":"sparkles-expert-observations/1"},"corpus_id":{"type":"string","minLength":1},"purpose":{"type":"string","minLength":1},"interpretation_contract":{"type":"object","additionalProperties":{"type":["string","boolean","number","null"]}},"observations":{"type":"array","items":{"$ref":"#/$defs/observation"}},"coverage":{"type":"object"}},"additionalProperties":false,"$defs":{"source":{"type":"object","required":["source_id","source_url","wording_fidelity","catalog_path","benchmark_manifest_path","relation_refs"],"properties":{"source_id":{"type":"string"},"source_url":{"type":"string"},"group_id":{"type":["string","null"]},"post_number":{"type":["integer","null"]},"location_text":{"type":["string","null"]},"wording_fidelity":{"enum":["catalog_paraphrase","verbatim_verified"]},"catalog_path":{"type":"string"},"benchmark_manifest_path":{"type":"string"},"media_linkage":{"type":["object","null"],"properties":{"benchmark_sample_ids":{"type":"array","minItems":1,"items":{"type":"string"}},"archive_status":{"type":["string","null"]},"full_original_verified":{"type":["boolean","null"]}},"required":["benchmark_sample_ids","archive_status","full_original_verified"],"additionalProperties":false},"relation_refs":{"type":"array","items":{"type":"string"}}},"additionalProperties":false},"observation":{"type":"object","required":["observation_id","sample_id","sample_domain","reviewer","source","observation","classification","machine_mapping","validation_usage"],"properties":{"observation_id":{"type":"string","minLength":1},"sample_id":{"type":["string","null"]},"sample_domain":{"enum":["simulation","real_stone","general_principle"]},"reviewer":{"type":"object","required":["name","reviewer_class","provenance"],"properties":{"name":{"type":"string"},"reviewer_class":{"enum":["expert"]},"provenance":{"enum":["explicit_label_reviewer","source_author_attribution","explicit_principle_reviewer"]}},"additionalProperties":false},"source":{"$ref":"#/$defs/source"},"observation":{"type":"object","required":["phenomenon","locality_text","viewing_condition","motion_condition","polarity","explicitness","source_wording","qualifier_text","relation_claim"],"properties":{"phenomenon":{"type":"string","minLength":1},"locality_text":{"type":["string","null"]},"viewing_condition":{"type":"string"},"motion_condition":{"type":"string"},"polarity":{"enum":["positive","negative","mixed","concern","descriptive","uncertain"]},"explicitness":{"enum":["explicit"]},"source_wording":{"type":"string","minLength":1},"qualifier_text":{"type":["string","null"]},"relation_claim":{"type":["object","null"]}},"additionalProperties":false},"classification":{"type":"array","minItems":1,"uniqueItems":true,"items":{"enum":["performance","geometry_style","perceptual_character","uncertainty","preference"]}},"machine_mapping":{"type":"object","required":["status","semantic_entities","source_interval","optical_event_refs","mapping_confidence"],"properties":{"status":{"enum":["pending_geometry","mapped","not_applicable"]},"semantic_entities":{"type":"array","items":{"type":"string"}},"source_interval":{"type":["object","null"]},"optical_event_refs":{"type":"array","items":{"type":"string"}},"mapping_confidence":{"type":["number","null"],"minimum":0,"maximum":1}},"additionalProperties":false},"validation_usage":{"type":"object","required":["designation","prior_use","rationale"],"properties":{"designation":{"enum":["development_sanity","held_out_candidate","not_suitable","semantic_principle"]},"prior_use":{"type":"string"},"rationale":{"type":"string","minLength":1}},"additionalProperties":false}},"additionalProperties":false}}}