{
  "schema_version": "sparkles-expert-observations/1",
  "corpus_id": "pricescope-karl-strmrdr-asscher-observations-v1",
  "purpose": "Provenance-preserving Karl_K / strmrdr observations from the existing #64 PriceScope archive, for downstream falsification of frozen Sparkles geometry/optical/perceptual methods. No new human or AI labels.",
  "interpretation_contract": {
    "expert_is_not_ground_truth": true,
    "source_observation_and_machine_mapping_are_separate": true,
    "catalog_wording_is_not_verbatim": "Every v1 source_wording field is the existing #64 catalog paraphrase unless wording_fidelity explicitly changes in a later revision.",
    "grey_is_not_leakage": "Do not normalize grey to leakage without an explicit source statement.",
    "holdout_rule": "A held_out_candidate may be called independent validation for a new method only if its observation was not used to design, tune, threshold, or select that method. Prior legacy-descriptor exposure is recorded separately.",
    "mapping_rule": "pending_geometry records must not acquire semantic facet IDs until #72 geometry is validated; original source wording/locality is immutable provenance."
  },
  "observations": [
    {
      "observation_id": "karl-p3-extremely-off",
      "sample_id": "p3-extremely-off",
      "sample_domain": "simulation",
      "reviewer": {
        "name": "Karl K.",
        "reviewer_class": "expert",
        "provenance": "explicit_label_reviewer"
      },
      "source": {
        "source_id": "pricescope-p3-article",
        "source_url": "https://www.pricescope.com/blog/performance-and-p3-facets-discussion-about-step-cut-diamonds",
        "group_id": "p3-static-labelled",
        "post_number": null,
        "location_text": "group p3-static-labelled / sample p3-extremely-off",
        "wording_fidelity": "catalog_paraphrase",
        "catalog_path": "docs/360/external-benchmark/pricescope/source-catalog.json",
        "benchmark_manifest_path": "docs/360/external-benchmark/pricescope/benchmark-manifest.json",
        "media_linkage": {
          "benchmark_sample_ids": [
            "p3-extremely-off"
          ],
          "archive_status": "archived_original",
          "full_original_verified": true
        },
        "relation_refs": []
      },
      "observation": {
        "phenomenon": "p3_angle_geometry",
        "locality_text": "P3 facets",
        "viewing_condition": "unspecified",
        "motion_condition": "unspecified",
        "polarity": "negative",
        "explicitness": "explicit",
        "source_wording": "p3 facets described as extremely far from proper angles",
        "qualifier_text": null,
        "relation_claim": null
      },
      "classification": [
        "performance",
        "geometry_style"
      ],
      "machine_mapping": {
        "status": "pending_geometry",
        "semantic_entities": [],
        "source_interval": null,
        "optical_event_refs": [],
        "mapping_confidence": null
      },
      "validation_usage": {
        "designation": "development_sanity",
        "prior_use": "none",
        "rationale": "Useful source-controlled P3 semantics, but simulation/static evidence is development/sanity material rather than held-out real-stone vendor-360 validation."
      }
    },
    {
      "observation_id": "karl-p3-slightly-off",
      "sample_id": "p3-slightly-off",
      "sample_domain": "simulation",
      "reviewer": {
        "name": "Karl K.",
        "reviewer_class": "expert",
        "provenance": "explicit_label_reviewer"
      },
      "source": {
        "source_id": "pricescope-p3-article",
        "source_url": "https://www.pricescope.com/blog/performance-and-p3-facets-discussion-about-step-cut-diamonds",
        "group_id": "p3-static-labelled",
        "post_number": null,
        "location_text": "group p3-static-labelled / sample p3-slightly-off",
        "wording_fidelity": "catalog_paraphrase",
        "catalog_path": "docs/360/external-benchmark/pricescope/source-catalog.json",
        "benchmark_manifest_path": "docs/360/external-benchmark/pricescope/benchmark-manifest.json",
        "media_linkage": {
          "benchmark_sample_ids": [
            "p3-slightly-off"
          ],
          "archive_status": "archived_original",
          "full_original_verified": true
        },
        "relation_refs": []
      },
      "observation": {
        "phenomenon": "p3_angle_geometry",
        "locality_text": "P3 facets",
        "viewing_condition": "unspecified",
        "motion_condition": "unspecified",
        "polarity": "concern",
        "explicitness": "explicit",
        "source_wording": "p3 facets described as only a little off",
        "qualifier_text": null,
        "relation_claim": null
      },
      "classification": [
        "performance",
        "geometry_style"
      ],
      "machine_mapping": {
        "status": "pending_geometry",
        "semantic_entities": [],
        "source_interval": null,
        "optical_event_refs": [],
        "mapping_confidence": null
      },
      "validation_usage": {
        "designation": "development_sanity",
        "prior_use": "none",
        "rationale": "Useful source-controlled P3 semantics, but simulation/static evidence is development/sanity material rather than held-out real-stone vendor-360 validation."
      }
    },
    {
      "observation_id": "karl-p3-acceptable-1",
      "sample_id": "p3-acceptable-1",
      "sample_domain": "simulation",
      "reviewer": {
        "name": "Karl K.",
        "reviewer_class": "expert",
        "provenance": "explicit_label_reviewer"
      },
      "source": {
        "source_id": "pricescope-p3-article",
        "source_url": "https://www.pricescope.com/blog/performance-and-p3-facets-discussion-about-step-cut-diamonds",
        "group_id": "p3-static-labelled",
        "post_number": null,
        "location_text": "group p3-static-labelled / sample p3-acceptable-1",
        "wording_fidelity": "catalog_paraphrase",
        "catalog_path": "docs/360/external-benchmark/pricescope/source-catalog.json",
        "benchmark_manifest_path": "docs/360/external-benchmark/pricescope/benchmark-manifest.json",
        "media_linkage": {
          "benchmark_sample_ids": [
            "p3-acceptable-1"
          ],
          "archive_status": "archived_original",
          "full_original_verified": true
        },
        "relation_refs": []
      },
      "observation": {
        "phenomenon": "p3_angle_geometry",
        "locality_text": "P3 facets",
        "viewing_condition": "unspecified",
        "motion_condition": "unspecified",
        "polarity": "positive",
        "explicitness": "explicit",
        "source_wording": "example described as having acceptable p3 angles",
        "qualifier_text": null,
        "relation_claim": null
      },
      "classification": [
        "performance",
        "geometry_style"
      ],
      "machine_mapping": {
        "status": "pending_geometry",
        "semantic_entities": [],
        "source_interval": null,
        "optical_event_refs": [],
        "mapping_confidence": null
      },
      "validation_usage": {
        "designation": "development_sanity",
        "prior_use": "none",
        "rationale": "Useful source-controlled P3 semantics, but simulation/static evidence is development/sanity material rather than held-out real-stone vendor-360 validation."
      }
    },
    {
      "observation_id": "karl-p3-acceptable-2",
      "sample_id": "p3-acceptable-2",
      "sample_domain": "simulation",
      "reviewer": {
        "name": "Karl K.",
        "reviewer_class": "expert",
        "provenance": "explicit_label_reviewer"
      },
      "source": {
        "source_id": "pricescope-p3-article",
        "source_url": "https://www.pricescope.com/blog/performance-and-p3-facets-discussion-about-step-cut-diamonds",
        "group_id": "p3-static-labelled",
        "post_number": null,
        "location_text": "group p3-static-labelled / sample p3-acceptable-2",
        "wording_fidelity": "catalog_paraphrase",
        "catalog_path": "docs/360/external-benchmark/pricescope/source-catalog.json",
        "benchmark_manifest_path": "docs/360/external-benchmark/pricescope/benchmark-manifest.json",
        "media_linkage": {
          "benchmark_sample_ids": [
            "p3-acceptable-2"
          ],
          "archive_status": "archived_original",
          "full_original_verified": true
        },
        "relation_refs": []
      },
      "observation": {
        "phenomenon": "p3_angle_geometry",
        "locality_text": "P3 facets",
        "viewing_condition": "unspecified",
        "motion_condition": "unspecified",
        "polarity": "positive",
        "explicitness": "explicit",
        "source_wording": "example described as having acceptable p3 angles",
        "qualifier_text": null,
        "relation_claim": null
      },
      "classification": [
        "performance",
        "geometry_style"
      ],
      "machine_mapping": {
        "status": "pending_geometry",
        "semantic_entities": [],
        "source_interval": null,
        "optical_event_refs": [],
        "mapping_confidence": null
      },
      "validation_usage": {
        "designation": "development_sanity",
        "prior_use": "none",
        "rationale": "Useful source-controlled P3 semantics, but simulation/static evidence is development/sanity material rather than held-out real-stone vendor-360 validation."
      }
    },
    {
      "observation_id": "karl-p3-acceptable-3",
      "sample_id": "p3-acceptable-3",
      "sample_domain": "simulation",
      "reviewer": {
        "name": "Karl K.",
        "reviewer_class": "expert",
        "provenance": "explicit_label_reviewer"
      },
      "source": {
        "source_id": "pricescope-p3-article",
        "source_url": "https://www.pricescope.com/blog/performance-and-p3-facets-discussion-about-step-cut-diamonds",